Sigla;Nome;Estrato;Indice.H;ISSN
ICCI;International Conference on Computing and Information;B4;1;
ICCIIS;International Conference on Communications and Intelligence Information Security;B5;3;
ICCIMA;International Conference on Computational Intelligence and Multimedia Applications;B2;18;
ICCI_A;IEEE International Conference on Cognitive Informatics;B2;18;
ICCL;IEEE International Conference on Computer Languages;B5;2;
ICCMS;International Conference on Computer Modeling and Simulation;B4;6;
ICCOPT;International Conference on Continuous Optimization;B5;1;
ICCS;International Conference on Computational Science;A2;37;
ICCSA;International Conference on Computational Science and its Applications;B1;27;
ICCSE;International Conference on Computer Science & Education;B4;6;
ICCST;Annual International Carnahan Conference on Security Technology;B4;8;
ICCS_A;International Conference on Conceptual Structures;B1;28;
ICCTA;International Conference on Computing: Theory and Applications;B3;11;
ICCV;IEEE International Conference on Computer Vision;A1;120;
ICDAR;IEEE International Conference on Document Analysis and Recognition;A2;48;
ICDCIT;International Conference on Distributed Computing and Internet Technology;B4;10;
ICDCN;IEEE International Conference on Distributed Computing and Networking;B4;10;
ICDCS;IEEE International Conference on Distributed Computing Systems;A1;78;
ICDE;IEEE International Conference on Data Engineering;A1;113;
ICDE_A;World Conference on Open Learning and Distance Education;B5;2;
ICDF;IFIP WG 11.9 International Conference on Digital Forensics;B5;1;
ICDIM;International Conference on Digital Information Management;B3;11;
ICDL;IEEE International Conference on Development and Learning;B3;15;
ICDL'EpiRob;IEEE Conference on Development and Learning and Epigenetic Robotics;B2;19;
ICDLE;International Conference on Distance Learning and Education;B5;1;
ICDM;IEEE International Conference on Data Mining;A1;77;
ICDS;International Conference on Digital Society;B3;11;
ICDT;International Conference on Database Theory;B1;27;
ICDVRAT;International Conference on Disability, Virtual Reality and Associated Technologies;B5;1;
ICE'B;International Conference on e'Business;B4;7;
ICEB;International Conference on Electronic Business;B4;6;
ICEBE;IEEE International Conference on e'Business Engineering;B2;20;
ICEC;International Conference on Electronic Commerce;B1;34;
ICECCS;IEEE International Conference on Engineering of Complex Computer Systems;B1;24;
ICECE;International Conference on Engineering and Computer Education;B4;5;
ICECS;IEEE International Conference on Electronics: Circuits and Systems;B1;24;
ICEC_A;IFIP International Conference on Entertainment Computing;B5;3;
ICEE;International Conference on Engineering Education;B2;16;
ICEIMT;International Confernce on Enterprise Integration and Modelling Technology;B4;7;
ICEIS;International Conference on Enterprise Information Systems;B1;24;
ICEIT;International Conference on Educational and Information Technology;B5;3;
ICELET;International Conference on E'Learning and E'Teaching;B5;2;
ICEMT;International Conference on Education and Management Technology;B5;3;
ICER;International Computing Education Research Workshop;B4;7;
ICETC;International Conference on Education Technology and Computer;B4;6;
ICETE;International Conference on E'Business and Telecommunication Networks;B4;5;
ICFCA;International Conference on Formal Concept Analysis;B2;20;
ICFCSE;International Conference on Future Computer Science and Education;B5;1;
ICFEM;International Conference on Formal Engineering Methods;B1;27;
ICFP;International Conference on Functional Programming;A2;53;
ICGEC;International Conference on Genetic and Evolutionary Computing;B5;3;
ICGeS;International Conference on Global E'Security;B5;2;
ICGSE;IEEE International Conference on Global Software Engineering;B2;20;
ICGT;International Conference on Graph Transformation;B1;25;
ICHIT;International Conference on Hybrid Information Technology;B2;16;
ICHL;International Conference on Hybrid Learning and Education;B4;6;
ICIAM;International Congress on Industrial and Applied Mathematics;B4;3;
ICIAP;International Conference on Image Analysis and Processing;B1;25;
ICIAS;International Conference on Intelligent and Advanced Systems;B4;9;
ICICA;International Conference on Information Computing and Applications;B5;2;
ICICS;International Conference on Information and Communication Security;B1;33;
ICIDS;International Conference on Interactive Digital Storytelling;B3;13;
ICIG;International Conference on Image and Graphics;B3;13;
ICINCO;International Conference on Informatics in Control Automation and Robotics;B4;10;
ICIP;IEEE International Conference on Image Processing;A1;69;
ICIQ;International Conference on Information Quality;B1;22;
ICIRA;International Conference on Intelligent Robotics and Applications;B4;8;
ICIS;International Conference on Information Systems;A2;47;
ICISO;International Conference on Informatics and Semiotics in Organisations;B5;1;
ICISS;International Conference on Information Systems Security;B3;13;
ICIS_A;IEEE/ACIS International Conference on Computer and Information Science;B2;20;
ICIT;IEEE International Conference on Industrial Technology;B3;11;
ICITA;International Conference on Information Technology and Applications;B2;18;
ICITS;International Conference on Intelligent Tutoring Systems;A2;44;
ICIW;International Conference on Internet and Web Applications and Services;B3;15;
ICL;International Conference on Interactive Collaborative Learning;B5;2;
ICLP;International Conference on Logic Programming;B1;35;
ICLS;International Conference of the Learning Sciences;B1;24;
ICMA;International Conference on Manufacturing Automation;B5;2;
ICMC;International Computer Music Conference;B1;32;
ICMCS;IEEE International Conference on Multimedia Computing and Systems;B3;6;
ICME;IEEE International Conference on Multimedia and Expo;A1;66;
ICMI;International Conference on Multimodal Interfaces;A2;46;
ICMIC;International Conference on Modelling, Identification and Control;B5;3;
ICML;International Conference on Machine Learning;A1;124;
ICMLA;International Conference on Machine Learning and Applications;B2;17;
ICMLC;International Conference on Machine Learning and Cybernetics;B4;6;
ICMPC;International Conference of Music Perception and Cognition;B4;9;
ICMR;ACM International Conference on Multimedia Retrieval;A2;51;
ICMSAO;International Conferecen on Modeling, Simulation and Applied Optimization;B5;3;
ICMT;International Conference on Model Transformation;B2;17;
ICMTS;IEEE International Conference on Microelectronics Test Structures;B3;14;
ICN;International Conference on Networking;B1;24;
ICNC;International Conference on Natural Computation;B4;5;
ICNCC;International Conference on Network Communication and Computer;B5;1;
ICNP;IEEE International Conference on Network Protocols;A1;65;
ICNS;International conference on Networking and Services;B3;14;
ICNSC;IEEE Intl Networking, Sensing and Control;B3;12;
ICoFCS;International Conference on Forensic Computer Science;B5;2;
ICOIN;International Conference on Information Networking;B1;22;
ICOMP;International Conference on Internet Computing;B2;20;
ICON;IEEE International Conference on Networks;B3;10;
ICONIP;International Conference on Neural Information Processing;B1;23;
ICONS;International Conference on Systems;B3;12;
ICORD;International Conference on Operational Research for Development;B5;1;
ICORE;International Conference on Reputation;B4;4;
ICOTA;International Conference on Optimization: Techniques And Applications;B5;3;
ICPADS;International Conference on Parallel and Distributed Systems;B1;28;
ICPC;IEEE International Conference on Program Comprehension;A2;41;
ICPP;International Conference on Parallel Processing;A2;42;
ICPR;International Conference on Pattern Recognition;A1;81;
ICPS;IEEE/ACS International Conference on Pervasive Services;B2;20;
ICRA;IEEE International Conference on Robotics and Automation;A1;116;
ICS;ACM International Conference on Supercomputing;A2;52;
ICSC;IEEE International Conference on Semantic Computing;B2;21;
ICSC_A;International Computer Science Conference;B2;16;
ICSE;ACM/IEEE International Conference on Software Engineering;A1;117;
ICSEA;International Conference on Software Engineering Advances;B3;13;
ICSM;IEEE International Conference on Software Maintenance;A2;53;
ICSMA;International Conference on Smart Manufacturing Application;B4;7;
ICSNC;International Conference on Systems and Networks Communication;B3;13;
ICSOB;International Conference on Software Business;B5;3;
ICSOC;International Conference on Service Oriented Computing;A2;47;
ICSOFT;International Conference on Software and Data Technologies;B4;10;
ICSP;International Conference on Stochastic Programming;B3;12;
ICSR;IEEE International Conference on Software Reuse;B1;23;
ICSSEA;International Conference on Software and Systems Engineering and their Applications;B4;5;
ICSSP;International Conference on on Software and Systems Process;B5;3;
ICST;International Conference on Software Testing, Verification and Validation;B2;21;
ICSTW;IEEE International Conference on Software Testing Verification and Validation Workshop;B3;14;
ICT;International Conference on Telecommunications;B2;17;
ICTAC;International Colloquium on Theoretical Aspects of Computing;B3;15;
ICTAI;IEEE International Conference on Tools with Artificial Intelligence;A2;38;
ICTEL;International Conference on Technology'Enhanced Learning;B5;3;
ICTERI;International Conference on ICT in Education, Research, and Industrial Applications;B5;1;
ICTL;International Conferece on Temporal Logic;B5;3;
ICTON;International Conference on Transparent Optical Networks;B4;9;
ICTSS;IFIP International Conference on Testing Software and Systems;B1;24;
ICUIMC;International Conference on Ubiquitous Information Management and Communication;B4;10;
ICUMT;Ultra Modern Telecommunications;B4;10;
ICVES;IEEE International Conference on Vehicular Electronics and Safety;B4;8;
ICVS;International Conference on Computer Vision Systems;B1;26;
ICVS_A;International Conference on Virtual Storytelling;B2;16;
ICWE;International Conference on Web Engineering;B1;28;
ICWET;International Conference & Workshop on Emerging Trends in Technology;B4;5;
ICWI;International Conference WWW/Internet;B2;16;
ICWL;International Conference on Web'based Learning;B3;14;
ICWMC;International Conference on Wireless and Mobile Communications;B3;14;
ICWN;International Conference on Wireless Networks;B2;17;
ICWS;IEEE International Conference on Web Services;A1;58;
ICWSM;AAAI International Conference on Weblogs and Social Media;B1;26;
IDA;International Symposium on Intelligent Data Analysis;B2;21;
IDAACS;Intelligent Data Acquisition and Advanced Computing Systems Technology and Applications;B4;9;
IDC;International Conference on Interaction Design and Children;B2;16;
IDC_A;IEEE Conference on Information Decision and Control;B4;9;
IDEAL;International Conference on Intelligent Data Engineering and Automated Learning;B2;20;
IDEAS_A;International Database Engineering and Applications Symposium;B1;28;
IE;International Conference on Intelligent Environments;B4;5;
IECON;Annual Conference of the IEEE Industrial Electronics Society;B1;36;
IEEEIS;IEEE Conference On Intelligent Systems;B1;22;
IEEEIT;IEEE Symposium on Information Theory;A1;63;
IEEERFID;IEEE IEEE International Conference on RFID;B3;12;
IESA;International Conference on Interoperability for Enterprise Software and Applications;B3;11;
IESS;International Conference on Exploring Services Science;B4;5;
IESS_A;International Embedded Systems Symposium;B5;1;
IFAC;Triennial Event of International Federation of Automatic Control;B2;12;
IFIPAI;IFIP Artificial Intelligence;B5;3;
IFL;International Symposium on Implementation and Application of Functional Languages;B3;2;
IFM;International Conference on Integrated Formal Methods;B1;24;
IFSA;International Fuzzy Systems Association World Congress;B1;26;
IGARSS;IEEE International Geoscience and Remote Sensing Symposium;B1;14;
IGCC;International Green Computing Conference;B4;9;
IGIC;IEEE International Games Innovation Conference;B5;1;
IGIP;IGIP International Symposium on Engineering Education;B4;4;
IH;Information Hiding Workshop;B1;26;
IHC;Simpósio Brasileiro sobre Fatores Humanos em Sistemas Computacionais;B4;10;
IHI;IHI ACM SIGHIT International Health Informatics Symposium;B4;6;
IITSI;International Symposium on Intelligent Information Technology and Security Informatics;B4;5;
IIWAS;Information Integration and Web'based Applications and Services;B3;12;
IJCAI;International Joint Conference on Artificial Intelligence;A1;90;
IJCAR;International Joint Conference on Automated Reasoning;B1;36;
IJCBS;International Joint Conference on Bioinformatics, Systems Biology and Intelligent Computing;B4;5;
IJCNLP;International Joint Conference on Natural Language Processing;B2;20;
IJCNN;IEEE International Joint Conference on Neural Networks;A2;46;
IKE;International Conference on Information and Knowledge Engineering;B4;10;
ILP;International Conference on Inductive Logic Programming;B1;27;
IM;IFIP/IEEE International Symposium on Integrated Network Management;B1;32;
IMAGAPP/IVAPP;International Conference on Imaging Theory and Applications and International Conference on Information Visualization Theory and Applications;B5;2;
IMC;ACM SIGCOMM Internet Measurement Conference;A1;93;
IMCSIT;International Multiconference on Computer Science and Information Technology;B4;10;
IMF;International Conference on IT Security Incident Management and IT Forensics;B4;5;
IMR;International Meshing Roundtable Conference;B1;28;
IMS;Advanced Information Management and Service;B4;4;
IMSA;International Conference on Internet and Multimedia Systems and Applications;B4;10;
IMS_A;IFAC Workshop on Intelligent Manufacturing Systems;B4;4;
INA'OCMC;Interconnection Network Architectures: On'Chip, Multi'Chip;B5;3;
INAP;Joint Conference on Application of Declarative Programming and Knowledge Management;B4;7;
InCoB;International Conference on Bioinformatics;B5;1;
INDIN;IEEE International Conference on Industrial Informatics;B3;12;
INDOCRYPT;International Conference on Cryptology in India;B1;30;
INEX;International Workshop of the Inititative for the Evaluation of XML Retrieval;B4;8;
INFOCOM;Annual Joint Conference of the IEEE Computer and Communications Societies;A1;204;
INFORMS;Joint International Meeting;B5;3;
INLG;International Natural Language Generation Conference;B2;21;
INOC;International Network Optimization Conference;B3;10;
InSITE;Informing Science and IT Education Conference;B4;6;
INTED;International Technology, Education and Development Conference;B4;4;
INTERACT;IFIP TC13 International Conference on Human'Computer Interaction;B1;30;
Interspeech;International Conference on Spoken Language Processing;A1;80;
IOLTS;IEEE International On'Line Testing Symposium;B1;25;
IPAW;International Provenance and Annotation Workshop;B2;20;
IPCCC;IEEE International Performance Computing and Communications Conference;B1;24;
IPCO;Conference on Integer Programming and Combinatorial Optimization;B1;26;
IPCV;International Conference on Image Processing Computer Vision and Pattern Recognition;B4;10;
IPDPS;IEEE International Parallel and Distributed Processing Symposium;A1;73;
IPDS;International Computer Performance and Dependability Symposium;B4;7;
IPEC;International Symposium on Parameterized and Exact Computation;B2;20;
IPMU;International Conference on Information Processing and Management of Uncertainty in Knowledge'Based Systems;B2;16;
IPOM;IEEE International Workshop on IP Operations and Management;B3;9;
IPPS;International Parallel Processing Symposium;A1;71;
IPSN;International Symposium on Information Processing in Sensor Networks;A1;88;
IPT;Workshop on Immersive Projection Technology;B3;9;
IPTPS;International Workshop on Peer'to'Peer Systems;A1;63;
IQIS;Information Quality in Information Systems;B3;15;
IR;Research and Development in Information Retrieval;B5;2;
IRI;IEEE International Conference on Information Reuse and Integration;B2;21;
IRMA;Information Resources Management Association International Conference;B4;6;
IROS;IEEE/RJS International Conference on Intelligent Robots and Systems;A1;58;
IS;IADIS International Conference Information Systems;B4;4;
ISAAC;International Symposium on Algorithms and Computation;B1;27;
ISADS;International Symposium on Autonomous Decentralized Systems;B1;25;
ISAM;IEEE International Symposium on Assembly and Manufacturing;B3;11;
ISBI;IEEE International Symposium on Biomedical Imaging: From Nano to Macro;B1;34;
ISBRA;International Symposium on Bioinformatics Research and Applications;B3;11;
ISC;Information Security Conference;A2;37;
ISCA;ACM International Symposium on Computer Architecture;A1;110;
ISCAS;IEEE International Symposium on Circuits and Systems;A1;159;
ISCC;IEEE Symposium on Computers and Communications;A2;43;
ISCIS;International Symposium on Computer and Information Sciences;B2;18;
ISCO;International Symposium on Combinatorial Optimization;B5;3;
ISCRAM;Intelligent Human Computer Systems for Crisis Response and Management;B4;9;
ISC_A;International Supercomputing Conference;B5;2;
ISD;International Conference on Information Systems Development;B4;3;
ISDA;International Conference on Intelligent Systems Design and Applications;B2;16;
ISDPE;International Symposium on Data, Privacy and E'commerce;B4;7;
ISECON;Information Systems Education Conference;B4;6;
ISECS;International Symposium Electronic Commerce and Security;B4;10;
ISER;International Symposium on Experimental Robotics;B3;7;
ISI;IEEE Intelligence and Security Informatics;B1;27;
ISIC;IEEE International Symposium on Intelligent Control;B3;15;
ISICA;International Symposium on Intelligence Computation and Applications;B4;9;
ISIE;IEEE International Symposium on Industrial Electronics;B1;32;
ISIMP;International Symposium on Intelligent Multimedia Video and Speech Processing;B2;16;
ISIPTA;International Symposium on Imprecise Probabilities: Theories and Applications;B2;21;
ISIT;IEEE International Symposium on Information Theory;B1;31;
ISITA;IEEE International Symposium on Information Theory and Its Applications;B3;14;
ISLPED;International Symposium on Low Power Electronics and Design;A1;66;
ISM;IEEE International Symposium on Multimedia;B2;19;
ISMAR;International Symposium on Mixed and Augmented Reality;A2;48;
ISMB;Intelligent Systems in Molecular Biology;A1;91;
ISMIR;International Conference on Music Information Retrieval;A1;61;
ISMIS;International Syposium on Methodologies for Intelligent Systems;B2;21;
ISMM;International Symposium on Mathematical Morphology;B1;25;
ISMM_A;International Symposium on Memory Management;B1;25;
ISMP;International Symposium on Mathematical Programming;B4;4;
ISMVL;IEEE International Symposium on Multiple'Valued Logic;B2;21;
ISoLA;International Symposium on Leveraging Applications of Formal Methods, Verification and Validation;B4;7;
ISORC;IEEE International Symposium on Object'Oriented Real'Time Distributed Computing;B1;33;
ISPA;International Symposium on Parallel and Distributed Processing and Applications;B3;13;
ISPASS;IEEE International Symposium on Performance Analysis of Systems and Software;B1;32;
ISPD;ACM International Symposium on Physical Design;A2;42;
ISPDC;International Symposium on Parallel and Distributed Computing;B2;17;
ISQED;IEEE International Symposium on Quality Electronic Design;B1;34;
ISRA;International Symposium on Robotics and Automation;B1;24;
ISRE;IEEE International Symposium on Requirements Engineering;B2;19;
ISRR;International Symposium of Robotics Research;B4;3;
ISSADS;IEEE International Symposium and School on Advance Distributed Systems;B4;7;
ISSCC;IEEE International Solid'State Circuits Conference;B1;28;
ISSCS;International Symposium on Signals Circuits and Systems;B3;12;
ISSDQ;International Symposium on Spatial Data Quality;B4;6;
ISSPA;IEEE International Symposium on Signal Processing and its Applications;B3;8;
ISSRE;IEEE International Symposium on Software Reliability Engineering;A2;41;
ISSTA;International Symposium on Software Testing and Analysis;A2;52;
IST;IEEE International Workshop on Imaging Systems and Techniques;B4;6;
ISTA;International Conference on Information Systems Technology and its Application;B3;11;
ISVLSI;IEEE Computer Society Annual Symposium on VLSI;B1;29;
ISWC;International Semantic Web Conference;A1;89;
ISWC_A;IEEE International Symposium on Wearable Computing;A2;47;
ISWPC;Wireless Pervasive Computing;B1;22;
ISWSA;International Conference on Intelligent Semantic Web'Services and Applications;B5;2;
ITAT;Conference on Theory and Practice of Information Technologies;B4;5;
ITBAM;International Conference on Information Technology in Bio' and Medical Informatics;B5;3;
ITC;International Test Conference;A1;62;
ITEM;Conference on Information Technology in Educational Management;B4;4;
ITHE;International Conference on Information Technology Based Higher;B4;5;
ITHET;International Conference on Information Technology Based Higher Education and Training;B3;13;
ITiCSE;Annual Conference on Integrating Technology into Computer Science Education;B1;35;
ITNG;International Conference on Information Technology New Generations;B1;22;
ITP;Interactive Theorem Proving continues TPHOL);B4;10;
ITRE;International Conference on Information Technology: Research and Education;B2;16;
ITS;International Conference on Interactive Tabletops and Surfaces;B2;17;
ITSC;Conference on Intelligent Transportation Systems;B1;25;
ITS_A;International Telecommunications Symposium;B4;10;
IUI;International Conference on Intelligent User Interfaces;A1;62;
IUKM;Integrated Uncertainty in Knowledge Modelling and Decision Making;B5;1;
IV;International Conference on Information Visualization;B1;32;
IVA;International Conference on Intelligent Virtual Agents;B1;30;
IVCNZ;Image and Vision Computing Conference;B4;10;
IV_A;Intelligent Vehicles Conference;B4;4;
IWANN;International Work'Conference on Artificial and Natural Neural Networks;B2;20;
IWCC;IEEE International Workshop on Cluster Computing;B4;8;
IWCIA;International Workshop on Combinatorial Image Analysis;B4;10;
IWCMC;ACM International Wireless Communications and Mobile Computing Conference;B1;25;
IWCS;International Workshop on Computational Semantics;B3;7;
IWFHR;International Workshop on Frontiers in Handwriting Recognition;B1;22;
IWLS;International Workshop on Logic and Synthesis;B2;19;
IWOS;International Workshop on Self'Organizing Systems;B4;10;
IWPSE;International Workshop on Principles of Software Evolution;B1;23;
IWPT;International Conference on Parsing Technologies;B3;13;
IWQoS;International Workshop on Quality of Service;A2;44;
IWSCA;IEEE International Workshop on Semantic Computing and Applications;B4;5;
IWSM'MENSURA;International Workshop on Software Measurement and the International Conference on Software Process and Product Measurement;B4;7;
IWSSIP;International Workshop on Systems Signals and Image Processing;B4;8;
JADT;International conference on statistical analysis of textual data;B4;6;
JCDL;ACM IEEE Joint Conference on Digital Libraries;A2;53;
JCIS;Joint Conference on Information Sciences;B2;18;
JDP;Jornada de Descrição do Português;B5;1;
JELIA;European Conference on Logics in Artificial Intelligence;B1;30;
JIISIC;Jornadas Iberoamericanas de Ingeniería de Software e Ingeniería del Conocimiento;B4;4;
JMLC;Joint Modular Languages Conference;B3;13;
JSSPP;Workshop on Job Scheduling Strategies for Parallel Processing;B1;32;
JTRES;International Workshop on Java Technologies for Real'time and Embedded Systems;B3;12;
JURIX;International Conference on Legal Knowledge and Information Systems;B3;12;
K'CAP;Knowledge Capture;B1;34;
KAMC;Knowledge Acquisition from Multimedia Content;B5;3;
KDD;ACM SIGKDD Conference on Knowledge Discovery and Data Mining;A1;133;
KES;International Conference on Knowledge'Based and Intelligent Information and Engineering Systems;B1;27;
KES'AMSTA;International Conference on Agent and Multi'Agent Systems: Technologies and Applications;B3;13;
KR;International Conference on Principles of Knowledge Representation and Reasoning;A2;46;
KSEM;International Conference on Knowledge Science, Engineering and Management;B3;11;
LA'WASP;Latin American Workshop on Aspect'Oriented Software Development;B4;4;
LA'WEB;Latin American Web Congress;B2;19;
LACLO;Latin American Conference on Learning Objects;B5;3;
LADC;Latin'American Symposium on Dependable Computing;B3;12;
LAGOS;Latin'American Algorithms Graphs and Optimization Symposium;B4;4;
LANC;Latin America Networking Conference;B4;6;
LANMAN;IEEE Workshop on Local and Metropolitan Area Networks;B2;17;
LANOMS;Latin American Network Operations and Management Symposium;B4;7;
LARS;IEEE Latin American Robotics Symposium;B4;8;
LASCAS;IEEE Latin American Symposium on Circuits and Systems ' LASCAS;B5;2;
LATA;Language and Automata Theory and Applications;B3;12;
LaTeCH;Workshop on Language Technology for Cultural Heritage, Social Sciences, and Humanities;B5;1;
LATIN;Latin American Symposium on Theoretical Informatics;B1;26;
LATINCOM;IEEE Latin'american Conference on Communications;B4;5;
Latincrypt;International Conference on Cryptology and Information Security in Latin;B4;5;
LATINTCS;Latin American Theoretical Informatics Symposium;B1;25;
LATW;IEEE Latin American Test Workshop;B4;8;
LAW;The Linguistic Annotation Workshop;B3;13;
LCN;IEEE Conference on Local Computer Networks;A2;48;
LCPC;International Workshop on Languages and Compilers for Parallel Computing;B4;9;
LCTES;ACM SIGPLAN/SIGBED Conference on Languages, Compilers, Tools and Theory for Embedded Systems;B1;34;
LDTA;Language Descriptions Tools and Applications;B4;7;
